location,dates,job-title,summary,pros,cons,overall-ratings,pros_clean,pros_lemmas,cons_clean,cons_lemmas,full_review_lemmas,pros_vader,cons_vader,cons_textblob,sentiment_final
none,2018-12-11,Current Employee - Anonymous Employee,Microsoft,"Culture, role impact, mission driven, collaboration","Volume of work is sometimes unmanageable,",5.0,culture role impact mission driven collaboration,culture role impact mission drive collaboration,volume of work is sometimes unmanageable,volume work sometimes unmanageable,culture role impact mission drive collaboration volume work sometimes unmanageable,0.0,0.0,0.0,Neutral
"Redmond, WA",2013-01-28,Current Employee - Anonymous Employee,Thoughts after 10 years....,"1. If you love tech, this is a great place. No doubt you'll talk tech (mostly the MSFT stack) from enterprise to consumer - from PCs to phones to Xboxes - from datacenter to desktop.  2. What were GREAT benefits are now VERY GOOD (took a small step down) but still probably better than you'll find at 99% of large corporations. If you've got family - the value of the benefits is even higher. 401k match is nice.  3. Even with it's struggles MSFT is still a cash printing machine. This means if you can keep your nose clean and do reasonable work, you can have a stable job, pay your bills, feed your family, and not worry (too much) about layoffs. The stock you own likely won't tank, but probably won't go up much either. You'll get a bonus each year and some stock. It's a decent life if you aren't looking to light the world on fire.","Brand on Your Resume: After many years of losing market share and struggling to be at the front end of innovation and the fact that there's 90,000 employees, don't think MSFT is necessarily going to be attractive on your resume to more agile and smaller companies.  Managing Your Career: Make you say this out loud so it registers - 90,000 employees work there. Double that for vendors. It is VERY hard to ""stand out"" and move up in the company. Don't expect your manager to be much of an advocate or enabler to help you meet your career goals - they are basically trying to survive the stack rank every year too. Not familiar with the stack rank? Check out the 2012 Vanity Fair article called ""Microsoft's Lost Decade"".",4.0, if you love tech this is a great place no doubt youll talk tech mostly the msft stack from enterprise to consumer  from pcs to phones to xboxes  from datacenter to desktop   what were great benefits are now very good took a small step down but still probably better than youll find at  of large corporations if youve got family  the value of the benefits is even higher k match is nice   even with its struggles msft is still a cash printing machine this means if you can keep your nose clean and do reasonable work you can have a stable job pay your bills feed your family and not worry too much about layoffs the stock you own likely wont tank but probably wont go up much either youll get a bonus each year and some stock its a decent life if you arent looking to light the world on fire,love tech great place no doubt talk tech mostly msft stack enterprise consumer pc phone xboxes datacenter desktop great benefit good take small step still probably well find large corporation get family value benefit even high k match nice even struggle msft still cash printing machine mean keep nose clean reasonable work stable job pay bill feed family not worry much layoff stock likely will not tank probably will not go much either get bonus year stock decent life not look light world fire,brand on your resume after many years of losing market share and struggling to be at the front end of innovation and the fact that theres  employees dont think msft is necessarily going to be attractive on your resume to more agile and smaller companies  managing your career make you say this out loud so it registers   employees work there double that for vendors it is very hard to stand out and move up in the company dont expect your manager to be much of an advocate or enabler to help you meet your career goals  they are basically trying to survive the stack rank every year too not familiar with the stack rank check out the  vanity fair article called microsofts lost decade,brand resume many year lose market share struggle front end innovation fact employee not think msft necessarily go attractive resume agile small company manage career make say loud register employee work double vendor hard stand move company not expect manager much advocate enabler help meet career goal basically try survive stack rank every year not familiar stack rank check vanity fair article call microsoft lose decade,love tech great place no doubt talk tech mostly msft stack enterprise consumer pc phone xboxes datacenter desktop great benefit good take small step still probably well find large corporation get family value benefit even high k match nice even struggle msft still cash printing machine mean keep nose clean reasonable work stable job pay bill feed family not worry much layoff stock likely will not tank probably will not go much either get bonus year stock decent life not look light world fire brand resume many year lose market share struggle front end innovation fact employee not think msft necessarily go attractive resume agile small company manage career make say loud register employee work double vendor hard stand move company not expect manager much advocate enabler help meet career goal basically try survive stack rank every year not familiar stack rank check vanity fair article call microsoft lose decade,0.9844,0.1714,0.08095238095238093,Positivo
"Redmond, WA",2018-12-09,Current Employee - Anonymous Employee,Technical Account Manager,Great company and Great people,I see no cons at this time,5.0,great company and great people,great company great people,i see no cons at this time,see no con time,great company great people see no con time,0.8481,-0.296,0.0,Negativo
"Chicago, IL",2018-12-09,Current Employee - CSA,Great company,"Benefits, work-life balance, tons of internal knowledge",Can't think of any right now,5.0,benefits worklife balance tons of internal knowledge,benefit worklife balance ton internal knowledge,cant think of any right now,can not think right,benefit worklife balance ton internal knowledge can not think right,0.3818,0.0,0.2857142857142857,Neutral
none,2018-12-09,Current Employee - Anonymous Employee,Great Company to work for,"Smart people, work life balance, growth mindset, challenging work",Can be hard to transfer internally,5.0,smart people work life balance growth mindset challenging work,smart people work life balance growth mindset challenge work,can be hard to transfer internally,hard transfer internally,smart people work life balance growth mindset challenge work hard transfer internally,0.7096,-0.1027,-0.14583333333333334,Negativo
"Redmond, WA",2018-12-03,Current Employee - Senior Program Manager,Sr. Program Manager,Challenging work and collaboration with brilliant coworkers.,Many horrible managers who are more focused on politics and their own self being.,5.0,challenging work and collaboration with brilliant coworkers,challenge work collaboration brilliant coworker,many horrible managers who are more focused on politics and their own self being,many horrible manager focused politic self,challenge work collaboration brilliant coworker many horrible manager focused politic self,0.6597,-0.1548,0.15,Negativo
none,2018-12-06,Current Employee - Anonymous Employee,Great place to work,Excellent place to work,do not have specific cons.,5.0,excellent place to work,excellent place work,do not have specific cons,not specific con,excellent place work not specific con,0.5719,0.0,0.0,Neutral
none,2018-12-06,Current Employee - Anonymous Employee,Great company,Great culture and employees are helpful,"It's a Big company, so expect mechanics/logistics of working in a big company",5.0,great culture and employees are helpful,great culture employee helpful,its a big company so expect mechanicslogistics of working in a big company,big company expect mechanicslogistic work big company,great culture employee helpful big company expect mechanicslogistic work big company,0.7845,0.0,0.0,Neutral
none,2018-12-05,Current Employee - Anonymous Employee,Great company to work for!,"Amazing benefits, culture and team.",Observed no notable cons for the company. Amazing experience working here.,5.0,amazing benefits culture and team,amazing benefit culture team,observed no notable cons for the company amazing experience working here,observe no notable con company amazing experience work,amazing benefit culture team observe no notable con company amazing experience work,0.7506,0.3818,0.17500000000000004,Positivo
"Bellevue, WA",2018-12-06,Current Employee - Software Engineer II,Microsoft Work Culture Review,The work culture and the environment is super beneficial to the employees.,Employees get too comfortable with the benefits and loyalties and might stick to a single team in Microsoft for a long time,5.0,the work culture and the environment is super beneficial to the employees,work culture environment super beneficial employee,employees get too comfortable with the benefits and loyalties and might stick to a single team in microsoft for a long time,employee get comfortable benefit loyalty might stick single team microsoft long time,work culture environment super beneficial employee employee get comfortable benefit loyalty might stick single team microsoft long time,0.7783,0.8316,0.09285714285714287,Positivo
none,2018-12-03,Current Employee - Anonymous Employee,Account Technology Strategist,Great culture and good work-life balance,Too many processes and it's a big company so it's easy to get lost in the crowd,5.0,great culture and good worklife balance,great culture good worklife balance,too many processes and its a big company so its easy to get lost in the crowd,many process big company easy get lose crowd,great culture good worklife balance many process big company easy get lose crowd,0.7906,0.2212,0.3111111111111111,Positivo
none,2018-12-04,Former Employee - Anonymous Employee,Microsoft takes very good care of their employees,Salary and Bonuses are very generous (can you say golden handcuffs?) Benefits are excellent Good teamwork within my workgroup,"While Satya has done a terrific job of changing the culture to a more positive stance, There is still a ways to go to achieve his ""One Microsoft"" vision.",5.0,salary and bonuses are very generous can you say golden handcuffs benefits are excellent good teamwork within my workgroup,salary bonus generous say golden handcuff benefit excellent good teamwork within workgroup,while satya has done a terrific job of changing the culture to a more positive stance there is still a ways to go to achieve his one microsoft vision,satya do terrific job change culture positive stance still way go achieve one microsoft vision,salary bonus generous say golden handcuff benefit excellent good teamwork within workgroup satya do terrific job change culture positive stance still way go achieve one microsoft vision,0.9468,0.8399,0.24242424242424243,Positivo
none,2018-12-02,Current Employee - Anonymous Employee,Top notch benefits and work like balance,"Great work like balance, benefits and career oportinities",Inefficiencies from time to time,5.0,great work like balance benefits and career oportinities,great work like balance benefit career oportinitie,inefficiencies from time to time,inefficiency time time,great work like balance benefit career oportinitie inefficiency time time,0.8481,0.0,0.0,Neutral
none,2018-12-01,Current Employee - Anonymous Employee,Good work life balance,Good work life balance and good job outlook,Management can be risk aversive,5.0,good work life balance and good job outlook,good work life balance good job outlook,management can be risk aversive,management risk aversive,good work life balance good job outlook management risk aversive,0.7003,-0.5719,0.0,Negativo
"Redmond, WA",2018-11-28,Current Employee - Senior Program Manager,Good Overall,Company with a clear purpose,a large share of workforce close to retirement and doesn't incur curiosity in day to day work,5.0,company with a clear purpose,company clear purpose,a large share of workforce close to retirement and doesnt incur curiosity in day to day work,large share workforce close retirement not incur curiosity day day work,company clear purpose large share workforce close retirement not incur curiosity day day work,0.3818,0.296,0.21428571428571427,Positivo
none,2018-11-26,Current Employee - Anonymous Employee,Excellent company to work for,"Great benefits, excellent work environment",none that I can point out,5.0,great benefits excellent work environment,great benefit excellent work environment,none that i can point out,none point,great benefit excellent work environment none point,0.886,0.0,0.0,Neutral
none,2018-11-26,Current Employee - Anonymous Employee,Service Engineer,"Great benefits, awesome management structure",Sometimes crunches can last longer than expected.,5.0,great benefits awesome management structure,great benefit awesome management structure,sometimes crunches can last longer than expected,sometimes crunch last long expect,great benefit awesome management structure sometimes crunch last long expect,0.8957,0.0,-0.05,Neutral
none,2018-12-11,Former Employee - Anonymous Employee,Great if you get support. A nightmare if you don't.,"Fantastic benefits, perks, and connections.","Misleading ideology statements, no HR response to toxic work environment complaints, bad work/life balance, entrenched corporate culture undermines company focus.",2.0,fantastic benefits perks and connections,fantastic benefit perk connection,misleading ideology statements no hr response to toxic work environment complaints bad worklife balance entrenched corporate culture undermines company focus,mislead ideology statement no hr response toxic work environment complaint bad worklife balance entrench corporate culture undermine company focus,fantastic benefit perk connection mislead ideology statement no hr response toxic work environment complaint bad worklife balance entrench corporate culture undermine company focus,0.7351,-0.91,-0.3499999999999999,Negativo
none,2018-11-22,Former Employee - Anonymous Employee,Program Manager,"Clarity of work, growth, smart coworkers, benefits","Salary, hierarchical, deep rooted long term relationships/loyalties in teams made it hard for new team members.",5.0,clarity of work growth smart coworkers benefits,clarity work growth smart coworker benefit,salary hierarchical deep rooted long term relationshipsloyalties in teams made it hard for new team members,salary hierarchical deep root long term relationshipsloyaltie team make hard new team member,clarity work growth smart coworker benefit salary hierarchical deep root long term relationshipsloyaltie team make hard new team member,0.8625,-0.1027,-0.05132575757575758,Negativo
none,2018-11-25,Current Employee - Anonymous Employee,Project Manager,Great work benefits and life,time consuming and tasking on brain,5.0,great work benefits and life,great work benefit life,time consuming and tasking on brain,time consume task brain,great work benefit life time consume task brain,0.7717,0.0,0.0,Neutral
"Beaufort, SC",2018-11-26,Former Employee - Occupational Health and Safety Specialist,Occupational Safety and Health Specialist in the field,Help people work safely in the field.,Start very early in the morning. Need to be in the field during bad weather.,5.0,help people work safely in the field,help people work safely field,start very early in the morning need to be in the field during bad weather,start early morning need field bad weather,help people work safely field start early morning need field bad weather,0.7096,-0.5423,-0.2849999999999999,Negativo
"Sammamish, WA",2018-12-09,Current Employee - Senior Program Manager,Autonomy and opportunity for impact. Define what and why and help guide how working with engineering managers.,Great work life balance. Impactful work.,Organizational decision making and prioritization can be problematic depending on the org and how your team fits into the org charter.,4.0,great work life balance impactful work,great work life balance impactful work,organizational decision making and prioritization can be problematic depending on the org and how your team fits into the org charter,organizational decision making prioritization problematic depend org team fit org charter,great work life balance impactful work organizational decision making prioritization problematic depend org team fit org charter,0.6249,-0.4404,0.0,Negativo
"Redmond, WA",2018-12-10,Former Employee - Anonymous Employee,Inventory Control Expert,"Benefits for part time employees, education opportunities, schedule flexibility, and high starting pay.","If you start at the retail level, you are unlikely to move to corporate. There is a lot of unnecessary jargon to learn. At the end of the day it is still retail and with retail comes all the ups and downs of that industry.",3.0,benefits for part time employees education opportunities schedule flexibility and high starting pay,benefit part time employee education opportunity schedule flexibility high starting pay,if you start at the retail level you are unlikely to move to corporate there is a lot of unnecessary jargon to learn at the end of the day it is still retail and with retail comes all the ups and downs of that industry,start retail level unlikely move corporate lot unnecessary jargon learn end day still retail retail come up down industry,benefit part time employee education opportunity schedule flexibility high starting pay start retail level unlikely move corporate lot unnecessary jargon learn end day still retail retail come up down industry,0.7351,0.0,-0.3,Neutral
none,2018-12-06,Current Employee - Global Program Manager,Global Program Manaer,Truly a global company. Satya Nadella Great coworkers.,"Cost savings means less collaboration. Teams will just stop doing a function, not considering the impacts to other teams and then upper management gets upset at teams delivering services on why they can't perform.  Tools and processes are blockers big time. More tools and processes are created to try and help the old processes and tools making for a complicated interrelated matrix with minimal cooperation between teams  No advancement outside of Seattle and if you are good at a role, its hard to ""be allowed"" to move on.",3.0,truly a global company satya nadella great coworkers,truly global company satya nadella great coworker,cost savings means less collaboration teams will just stop doing a function not considering the impacts to other teams and then upper management gets upset at teams delivering services on why they cant perform  tools and processes are blockers big time more tools and processes are created to try and help the old processes and tools making for a complicated interrelated matrix with minimal cooperation between teams  no advancement outside of seattle and if you are good at a role its hard to be allowed to move on,cost saving mean less collaboration team stop function not consider impact team upper management get upset team deliver service can not perform tool process blocker big time tool process create try help old process tool make complicated interrelated matrix minimal cooperation team no advancement outside seattle good role hard allow move,truly global company satya nadella great coworker cost saving mean less collaboration team stop function not consider impact team upper management get upset team deliver service can not perform tool process blocker big time tool process create try help old process tool make complicated interrelated matrix minimal cooperation team no advancement outside seattle good role hard allow move,0.7906,0.0516,0.010606060606060603,Positivo
"Redmond, WA",2018-12-07,Former Employee - Principal Level Manager,Can be a great place to work,"Smart people, lots of different products and technologies to work on, growing respect real work/life balance.",Most execs still have no idea how to deal with the AI revolution.,4.0,smart people lots of different products and technologies to work on growing respect real worklife balance,smart people lot different product technology work grow respect real worklife balance,most execs still have no idea how to deal with the ai revolution,exec still no idea deal ai revolution,smart people lot different product technology work grow respect real worklife balance exec still no idea deal ai revolution,0.7579,-0.296,0.5,Negativo
"Redmond, WA",2018-12-07,Current Employee - Software Engineer-II,"Great place to work, lower salary than Google","Intelligent coworkers, good leadership, focus on employee happiness",Lower salary than other large software companies in area,4.0,intelligent coworkers good leadership focus on employee happiness,intelligent coworker good leadership focus employee happiness,lower salary than other large software companies in area,low salary large software company area,intelligent coworker good leadership focus employee happiness low salary large software company area,0.8591,-0.296,0.04464285714285714,Negativo
"Research Triangle Park, NC",2018-12-09,Former Employee - Senior Software Engineer,Company lets managers and leads publicly reprimand their reports for technical or performance reasons,"Challenging work and environment, very capable coworkers","The company encourages a culture of managers and leads publicly reprimanding their reports for technical or performance reasons. Such feedback should be given in a private office or conf room setting rather than in hallways. An aggressive performance culture is great and poor performers can be terminated, but that should be done without humiliating well qualified engineers in front of their colleagues.",2.0,challenging work and environment very capable coworkers,challenge work environment capable coworker,the company encourages a culture of managers and leads publicly reprimanding their reports for technical or performance reasons such feedback should be given in a private office or conf room setting rather than in hallways an aggressive performance culture is great and poor performers can be terminated but that should be done without humiliating well qualified engineers in front of their colleagues,company encourage culture manager lead publicly reprimand report technical performance reason feedback give private office conf room set rather hallway aggressive performance culture great poor performer terminate do without humiliate well qualified engineer front colleague,challenge work environment capable coworker company encourage culture manager lead publicly reprimand report technical performance reason feedback give private office conf room set rather hallway aggressive performance culture great poor performer terminate do without humiliate well qualified engineer front colleague,0.5413,0.3096,0.06666666666666667,Positivo
"Redmont Park, AL",2018-12-06,Former Employee - Product Manager,Good Company!,good people which are nice to work with,long working hours at times,4.0,good people which are nice to work with,good people nice work,long working hours at times,long work hour time,good people nice work long work hour time,0.6908,0.0,-0.05,Neutral
"Bridgewater, NJ",2018-12-03,Former Employee - Assistant Store Manager,"Amazing company, but retail branch is flawed","Company mission and vision is second to none. Benefits are amazing, flexibility for a retail job is unrivaled. You get to use the latest and greatest products and software. One of the best things about the company is that the larger corporation listens to its people out in the field to improve on products and services. Tons of opportunity to learn new things.","Very little room for advancement because there are so few stores. There is almost no accountability unless they don't like you. Mixed messaging is common, but the bottom line is that you'll be expected to just do as you're told.",4.0,company mission and vision is second to none benefits are amazing flexibility for a retail job is unrivaled you get to use the latest and greatest products and software one of the best things about the company is that the larger corporation listens to its people out in the field to improve on products and services tons of opportunity to learn new things,company mission vision second none benefit amazing flexibility retail job unrivaled get use late great product software one good thing company large corporation listen people field improve product service ton opportunity learn new thing,very little room for advancement because there are so few stores there is almost no accountability unless they dont like you mixed messaging is common but the bottom line is that youll be expected to just do as youre told,little room advancement store almost no accountability unless not like mixed messaging common bottom line expect tell,company mission vision second none benefit amazing flexibility retail job unrivaled get use late great product software one good thing company large corporation listen people field improve product service ton opportunity learn new thing little room advancement store almost no accountability unless not like mixed messaging common bottom line expect tell,0.9223,-0.252,-0.16875,Negativo
none,2018-12-06,Current Employee - Anonymous Employee,Data scientist,work life balance single office,salary is too low. too many levels.,3.0,work life balance single office,work life balance single office,salary is too low too many levels,salary low many level,work life balance single office salary low many level,0.0,-0.2732,0.25,Negativo
