location,dates,job-title,summary,pros,cons,overall-ratings,pros_clean,pros_lemmas,cons_clean,cons_lemmas,full_review_lemmas,pros_vader,cons_vader,cons_textblob,sentiment_final
"Redmond, WA",2018-09-26,Current Employee - Software Engineer,Microsoft,1. Good work life balance. 2. Chance to work in well known products and learn inside technology.,1. Engineering process contains lots of frictions. 2. product iterations are slow.,3.0, good work life balance  chance to work in well known products and learn inside technology,good work life balance chance work well know product learn inside technology, engineering process contains lots of frictions  product iterations are slow,engineering process contain lot friction product iteration slow,good work life balance chance work well know product learn inside technology engineering process contain lot friction product iteration slow,0.7184,0.0,-0.30000000000000004,Neutral
none,2018-09-11,Current Employee - Anonymous Employee,Escalation Engineer,Great place to work in,not any worth to be mentioned,5.0,great place to work in,great place work,not any worth to be mentioned,not worth mention,great place work not worth mention,0.6249,-0.1695,0.3,Negativo
"Los Angeles, CA",2018-09-10,Former Employee - Consultant,Great!,Amazing. Managers were really great.,Some bad stuff. No free food.,5.0,amazing managers were really great,amazing manager really great,some bad stuff no free food,bad stuff no free food,amazing manager really great bad stuff no free food,0.8479,-0.34,-0.44999999999999996,Negativo
none,2018-09-24,Current Employee - Anonymous Employee,Empowered,Empowered to do great work,Challenge to move vertically in field,4.0,empowered to do great work,empower great work,challenge to move vertically in field,challenge move vertically field,empower great work challenge move vertically field,0.6249,0.0772,0.0,Positivo
none,2018-09-24,Former Employee - Anonymous Employee,Software Engineer,"Good pay, culture is solid",Difficult to really get into leadership,4.0,good pay culture is solid,good pay culture solid,difficult to really get into leadership,difficult really get leadership,good pay culture solid difficult really get leadership,0.4767,-0.3612,-0.15,Negativo
"Redmond, WA",2018-08-27,Current Employee - Principal Lead Program Manager,"Great Company, Great Culture!","Be yourself, encouraged to do your best, great opportunities for growth and development, great benefits and a great corporate citizen.",Rams inclusiveness down your throat and sets strange diversity goals that are not based on merit.,5.0,be yourself encouraged to do your best great opportunities for growth and development great benefits and a great corporate citizen,encourage good great opportunity growth development great benefit great corporate citizen,rams inclusiveness down your throat and sets strange diversity goals that are not based on merit,ram inclusiveness throat set strange diversity goal not base merit,encourage good great opportunity growth development great benefit great corporate citizen ram inclusiveness throat set strange diversity goal not base merit,0.9794,-0.4822,-0.10277777777777777,Negativo
"Seattle, WA",2018-09-22,Current Employee - Senior Business Program Manager,"13 years, change is slow","Career movement opportunity, flexibility to wfh sometimes","Duplication of roles, multiple people in diff groups working on the same thing, lack of clarity from upper management, running around in circles to react to requests from CVPs, old school buildings (can’t bring dogs), global CORP roles expectation to work crazy hours",3.0,career movement opportunity flexibility to wfh sometimes,career movement opportunity flexibility wfh sometimes,duplication of roles multiple people in diff groups working on the same thing lack of clarity from upper management running around in circles to react to requests from cvps old school buildings can’t bring dogs global corp roles expectation to work crazy hours,duplication role multiple people diff group work thing lack clarity upper management run around circle react request cvps old school building can not bring dog global corp role expectation work crazy hour,career movement opportunity flexibility wfh sometimes duplication role multiple people diff group work thing lack clarity upper management run around circle react request cvps old school building can not bring dog global corp role expectation work crazy hour,0.6369,-0.25,-0.08333333333333333,Negativo
none,2018-09-23,Current Employee - Anonymous Employee,Great place to work if you're on the right team,"Work-life balance, good environment if you're on a good team","""Doing the right thing"" can be hard, lots of time required and process gets in the way",4.0,worklife balance good environment if youre on a good team,worklife balance good environment good team,doing the right thing can be hard lots of time required and process gets in the way,right thing hard lot time require process get way,worklife balance good environment good team right thing hard lot time require process get way,0.7003,-0.1027,-0.0029761904761904934,Negativo
none,2018-09-24,Current Employee - Anonymous Employee,Empowered,Empowered to do great work,Challenge to move vertically in field,4.0,empowered to do great work,empower great work,challenge to move vertically in field,challenge move vertically field,empower great work challenge move vertically field,0.6249,0.0772,0.0,Positivo
none,2018-09-07,Current Employee - Anonymous Employee,Awesome,"Nice worker, a good place to learn a lot",Need a lot of dedication,5.0,nice worker a good place to learn a lot,nice worker good place learn lot,need a lot of dedication,need lot dedication,nice worker good place learn lot need lot dedication,0.6908,0.0,0.0,Neutral
"Reston, VA",2018-09-13,Current Employee - User Experience Consultant,UX Consultant,"Travel a lot, working with many different industries across various industries","Terrible internal politics, more resistance internally with Microsoft-own internal teams than externally with customers",4.0,travel a lot working with many different industries across various industries,travel lot work many different industry across various industry,terrible internal politics more resistance internally with microsoftown internal teams than externally with customers,terrible internal politic resistance internally microsoftown internal team externally customer,travel lot work many different industry across various industry terrible internal politic resistance internally microsoftown internal team externally customer,0.0,-0.4767,-0.08333333333333333,Negativo
"South Seattle, WA",2018-09-21,Former Employee - Software Developer,Cog in a machine.,"Large company, teams vary alot some are great others are not",I highly do not recommend UST (Universal Store Team),3.0,large company teams vary alot some are great others are not,large company team vary alot great other not,i highly do not recommend ust universal store team,highly not recommend ust universal store team,large company team vary alot great other not highly not recommend ust universal store team,0.6249,-0.3343,-0.04,Negativo
"Redmond, WA",2018-09-21,Current Employee - Senior Software Engineer,Microsoft,Benefits are very nice . Open source is catching up.,Slow mover and you can get stuck .,3.0,benefits are very nice  open source is catching up,benefit nice open source catch,slow mover and you can get stuck ,slow mover get stick,benefit nice open source catch slow mover get stick,0.6901,-0.25,-0.30000000000000004,Negativo
none,2018-09-06,Current Employee - Anonymous Employee,Microsoft Review,"- Amazing engineers working with me, among the best engineers I've ever worked with - Challenging and interesting project",- Unreasonable expectations at times,5.0, amazing engineers working with me among the best engineers ive ever worked with  challenging and interesting project,amazing engineer work among good engineer ever work challenging interesting project, unreasonable expectations at times,unreasonable expectation time,amazing engineer work among good engineer ever work challenging interesting project unreasonable expectation time,0.9062,0.0,0.0,Neutral
"Bellevue, WA",2018-09-06,Former Employee - Software Engineer,Software Engineer,Excellent Place to work and start your career. Great mentors and Great team,Not any cons to think of,5.0,excellent place to work and start your career great mentors and great team,excellent place work start career great mentor great team,not any cons to think of,not con think,excellent place work start career great mentor great team not con think,0.9169,0.0,0.0,Neutral
"Redmond, WA",2018-09-20,Current Employee - Senior Software Engineer,Great company,Unique company with breadth of technology and products,too big .. get lost in the ocean sometimes,4.0,unique company with breadth of technology and products,unique company breadth technology product,too big  get lost in the ocean sometimes,big get lose ocean sometimes,unique company breadth technology product big get lose ocean sometimes,0.0,-0.3182,0.0,Negativo
"Redmond, WA",2018-09-22,Former Employee - Software Developer,Fairly okay!,A very middle of the road place to work,Sometimes you’re just about ready to have too much fun!,2.0,a very middle of the road place to work,middle road place work,sometimes you’re just about ready to have too much fun,sometimes ’re ready much fun,middle road place work sometimes ’re ready much fun,0.0,0.7263,0.2875,Positivo
"Redmond, WA",2018-09-01,Current Employee - Anonymous Employee,One of the best companies on the rebound,"The benefits are some of the best out there. Moreover, the stock has been steadily going up.","As a big company, it's hard to get recognized and stand out.",5.0,the benefits are some of the best out there moreover the stock has been steadily going up,benefit good moreover stock steadily go,as a big company its hard to get recognized and stand out,big company hard get recognize stand,benefit good moreover stock steadily go big company hard get recognize stand,0.7783,-0.1027,-0.14583333333333334,Negativo
none,2018-09-19,Former Employee - Anonymous Employee,A good retail experience,An Interesting and changing environment,Not much room to grow and move up.,3.0,an interesting and changing environment,interesting change environment,not much room to grow and move up,not much room grow move,interesting change environment not much room grow move,0.4019,0.0,-0.1,Neutral
none,2018-09-04,Former Employee - Anonymous Employee,Intern Review,Great company culture. Truly encourages you to learn.,"Most jobs will be in Redmond, Washington.",5.0,great company culture truly encourages you to learn,great company culture truly encourage learn,most jobs will be in redmond washington,job redmond washington,great company culture truly encourage learn job redmond washington,0.872,0.0,0.5,Neutral
none,2018-09-04,Former Employee - Anonymous Employee,Explorer Intern,"Enriching, diverse set of people, growth opportunities","Hard to leave, easy to get comfortable",5.0,enriching diverse set of people growth opportunities,enrich diverse set people growth opportunity,hard to leave easy to get comfortable,hard leave easy get comfortable,enrich diverse set people growth opportunity hard leave easy get comfortable,0.6369,0.6808,0.18055555555555558,Positivo
"Chicago, IL",2018-09-04,Current Employee - Azure TSP,Technical Solution Professional is the best job at Microsoft,"Excellent flexibility, direct contact with the Product Groups. You get to work with customers and share success. Tons of opportunity for learning. I love this job because I get to stay technical but also work with our innovative customers.  Also, benefits are really good. 401K match is terrific. Time off. Work / life balance. Salary and benefits are really great for the TSP as well (you get both RBI and CBI, which is outstanding). Stock awards too. You have lots of opportunity to be very well compensated if you deliver results.","You are expected to deliver results. This is not a con, really, but you cannot ride your past successes. Deliver results and get rewarded.",5.0,excellent flexibility direct contact with the product groups you get to work with customers and share success tons of opportunity for learning i love this job because i get to stay technical but also work with our innovative customers  also benefits are really good k match is terrific time off work  life balance salary and benefits are really great for the tsp as well you get both rbi and cbi which is outstanding stock awards too you have lots of opportunity to be very well compensated if you deliver results,excellent flexibility direct contact product group get work customer share success ton opportunity learn love job get stay technical also work innovative customer also benefit really good k match terrific time work life balance salary benefit really great tsp well get rbi cbi outstanding stock award lot opportunity well compensate deliver result,you are expected to deliver results this is not a con really but you cannot ride your past successes deliver results and get rewarded,expect deliver result not con really not ride past success deliver result get reward,excellent flexibility direct contact product group get work customer share success ton opportunity learn love job get stay technical also work innovative customer also benefit really good k match terrific time work life balance salary benefit really great tsp well get rbi cbi outstanding stock award lot opportunity well compensate deliver result expect deliver result not con really not ride past success deliver result get reward,0.9938,0.8807,-0.049999999999999996,Positivo
"Redmond, WA",2018-09-05,Former Employee - Program Manager,Good Group,"mission oriented, open to new ideas within limits, friendly",inflexible deadlines and tedious SQL query writing,5.0,mission oriented open to new ideas within limits friendly,mission orient open new idea within limit friendly,inflexible deadlines and tedious sql query writing,inflexible deadline tedious sql query write,mission orient open new idea within limit friendly inflexible deadline tedious sql query write,0.4939,0.0,-0.45,Neutral
none,2018-09-18,Former Employee - Anonymous Employee,Good place to work overall,"Smart engineers, many interesting work options","Slow moving, , suffers from not-invented-here syndrome",4.0,smart engineers many interesting work options,smart engineer many interesting work option,slow moving  suffers from notinventedhere syndrome,slow move suffer notinventedhere syndrome,smart engineer many interesting work option slow move suffer notinventedhere syndrome,0.6597,-0.4767,-0.45,Negativo
"Redmond, WA",2018-08-24,Former Employee - Anonymous Employee,Senior Digital Marketing Manager,Great pivot from Balmer to Nadella with huge upside in the Cloud business.,A little to focused on molding the perfect HR ratios of an idealized demographics vs. just having the best people for the any team.,5.0,great pivot from balmer to nadella with huge upside in the cloud business,great pivot balmer nadella huge upside cloud business,a little to focused on molding the perfect hr ratios of an idealized demographics vs just having the best people for the any team,little focus mold perfect hr ratio idealized demographic vs good people team,great pivot balmer nadella huge upside cloud business little focus mold perfect hr ratio idealized demographic vs good people team,0.7506,0.9189,0.6041666666666666,Positivo
none,2018-09-03,Current Employee - Anonymous Employee,Love the Company Culture from Satya,satya is a great leader with strong values. he truly is trying to make the company a fantastic place to work and is investing in the right areas to continue leadership in cloud computing,field leadership and culture can be very political.,5.0,satya is a great leader with strong values he truly is trying to make the company a fantastic place to work and is investing in the right areas to continue leadership in cloud computing,satya great leader strong value truly try make company fantastic place work invest right area continue leadership cloud computing,field leadership and culture can be very political,field leadership culture political,satya great leader strong value truly try make company fantastic place work invest right area continue leadership cloud computing field leadership culture political,0.9485,0.0,0.0,Neutral
"Redmond, WA",2018-09-17,Current Employee - Principal Software Engineering Manager,You can have a long time career here,"The company is revitalized and reinventing itself. Open to new ideas, looking for customers where they are, moving away from ""everything Windows"" mentality.",Old thinking still lingers in some teams and is hard to change. The company is still not nimble enough to take advantage of new trends and is missing on some big opportunities.,4.0,the company is revitalized and reinventing itself open to new ideas looking for customers where they are moving away from everything windows mentality,company revitalize reinvent open new idea look customer move away everything window mentality,old thinking still lingers in some teams and is hard to change the company is still not nimble enough to take advantage of new trends and is missing on some big opportunities,old thinking still linger team hard change company still not nimble enough take advantage new trend miss big opportunity,company revitalize reinvent open new idea look customer move away everything window mentality old thinking still linger team hard change company still not nimble enough take advantage new trend miss big opportunity,0.0,0.25,-0.04255050505050506,Positivo
none,2018-09-18,Current Employee - Anonymous Employee,Sr. Director,Smart people Company has new motivation,Youth movement in Management Focus on diversity and not on capability,2.0,smart people company has new motivation,smart people company new motivation,youth movement in management focus on diversity and not on capability,youth movement management focus diversity not capability,smart people company new motivation youth movement management focus diversity not capability,0.6249,0.0,0.0,Neutral
none,2018-09-19,Current Employee - Anonymous Employee,Not all teams have the externally touted great culture,Benefits Highly experienced employees to learn from,Bereaucracy. Org (which you may have no control over) can determine your career progression. Managers can prevent you from switching in non-transparent ways Senior employee astroturfing.,2.0,benefits highly experienced employees to learn from,benefit highly experienced employee learn,bereaucracy org which you may have no control over can determine your career progression managers can prevent you from switching in nontransparent ways senior employee astroturfing,bereaucracy org may no control determine career progression manager prevent switch nontransparent way senior employee astroturfe,benefit highly experienced employee learn bereaucracy org may no control determine career progression manager prevent switch nontransparent way senior employee astroturfe,0.3818,-0.2732,0.0,Negativo
