location,dates,job-title,summary,pros,cons,overall-ratings,pros_clean,pros_lemmas,cons_clean,cons_lemmas,full_review_lemmas,pros_vader,cons_vader,cons_textblob,sentiment_final
none,2018-07-06,Current Employee - Anonymous Employee,SWE in Msft,"Good for new hires, you can learn a lot. Since it's a big company, you can try many things within it to find you passion. Good benefits.","Depends on the team, way too much stress. Sometimes the team work is good, but too many reorgs makes things unstable. The more senior you get, the more corporate politics you have to deal with. Underpays compared to companies of same or even less size.",3.0,good for new hires you can learn a lot since its a big company you can try many things within it to find you passion good benefits,good new hire learn lot since big company try many thing within find passion good benefit,depends on the team way too much stress sometimes the team work is good but too many reorgs makes things unstable the more senior you get the more corporate politics you have to deal with underpays compared to companies of same or even less size,depend team way much stress sometimes team work good many reorgs make thing unstable senior get corporate politic deal underpay compare company even less size,good new hire learn lot since big company try many thing within find passion good benefit depend team way much stress sometimes team work good many reorgs make thing unstable senior get corporate politic deal underpay compare company even less size,0.886,-0.4939,0.2791666666666667,Negativo
"Redmond, WA",2018-07-06,Current Employee - Anonymous Employee,SR global logistics Manager,"great company, good benefits , have a lot to learned that they give you opportunities","Rough environment, no team players , challenging place to work",3.0,great company good benefits  have a lot to learned that they give you opportunities,great company good benefit lot learn give opportunity,rough environment no team players  challenging place to work,rough environment no team player challenge place work,great company good benefit lot learn give opportunity rough environment no team player challenge place work,0.9042,-0.1531,0.2,Negativo
"Oak Brook, IL",2018-07-05,Current Employee - SERVICE ADVISOR,Great Company To Work For,They listen and truly care about their employees. They provide us opportunities for improvement in the company.,"There isn't much negative things to say! Microsoft provides great benefits and allows for a great work/life balance. The only thing I wish is Microsoft market their Surface brands better. You don't see as much Surface commercials as you do Apple, Google, or Amazon.",4.0,they listen and truly care about their employees they provide us opportunities for improvement in the company,listen truly care employee provide we opportunity improvement company,there isnt much negative things to say microsoft provides great benefits and allows for a great worklife balance the only thing i wish is microsoft market their surface brands better you dont see as much surface commercials as you do apple google or amazon,not much negative thing say microsoft provide great benefit allow great worklife balance thing wish microsoft market surface brand well not see much surface commercial apple google amazon,listen truly care employee provide we opportunity improvement company not much negative thing say microsoft provide great benefit allow great worklife balance thing wish microsoft market surface brand well not see much surface commercial apple google amazon,0.8934,0.9656,0.32083333333333336,Positivo
"Redmond, WA",2018-06-20,Current Employee - Senior Animator,Great job. <3,"Lotta money, health insurance is nice, I get to work with my best friends all day.",Even at 343 the environment is way too corporate/producer-heavy/meeting-heavy.,5.0,lotta money health insurance is nice i get to work with my best friends all day,lotta money health insurance nice get work good friend day,even at  the environment is way too corporateproducerheavymeetingheavy,even environment way corporateproducerheavymeetingheavy,lotta money health insurance nice get work good friend day even environment way corporateproducerheavymeetingheavy,0.8779,0.0,0.0,Neutral
none,2018-06-20,Current Employee - Anonymous Employee,Committed to Growth Mindset,The company has changed completely under Satya. It strives to do the best that it can with people and products.,It is still a big company. Lots of policies and procedures. Has trouble figuring out how to best manage and develop remote workforce.,5.0,the company has changed completely under satya it strives to do the best that it can with people and products,company change completely satya strive good people product,it is still a big company lots of policies and procedures has trouble figuring out how to best manage and develop remote workforce,still big company lot policy procedure trouble figure well manage develop remote workforce,company change completely satya strive good people product still big company lot policy procedure trouble figure well manage develop remote workforce,0.6369,0.3612,0.17500000000000002,Positivo
"Redmond, WA",2018-06-18,Former Employee - Content Writer,It all depends on your manager,Great benefits. Working on products that help and affect many people.,"Slow moving. Too many managers. Managers feel the need to prove something by changing established processes. Often, they can't explain why, they just want their review to look good. Your success depends on your manager. I had many managers, the last one was unsupportive, and became openly hostile when I complained, making up a lot of untrue things about me. HR ignored my complaints. I felt I had no choice buy to leave. Even now, I can't give away to much about my position for feat that the manager will try to retaliate.",3.0,great benefits working on products that help and affect many people,great benefit work product help affect many people,slow moving too many managers managers feel the need to prove something by changing established processes often they cant explain why they just want their review to look good your success depends on your manager i had many managers the last one was unsupportive and became openly hostile when i complained making up a lot of untrue things about me hr ignored my complaints i felt i had no choice buy to leave even now i cant give away to much about my position for feat that the manager will try to retaliate,slow move many manager manager feel need prove something change established process often can not explain want review look good success depend manager many manager last one unsupportive become openly hostile complain make lot untrue thing hr ignore complaint feel no choice buy leave even can not give away much position feat manager try retaliate,great benefit work product help affect many people slow move many manager manager feel need prove something change established process often can not explain want review look good success depend manager many manager last one unsupportive become openly hostile complain make lot untrue thing hr ignore complaint feel no choice buy leave even can not give away much position feat manager try retaliate,0.8555,-0.5859,0.17777777777777776,Negativo
none,2018-06-19,Current Employee - Anonymous Employee,Senior account manager,Incredible benefits and amazing pay,Hard to move and into management,5.0,incredible benefits and amazing pay,incredible benefit amazing pay,hard to move and into management,hard move management,incredible benefit amazing pay hard move management,0.7184,-0.1027,-0.2916666666666667,Negativo
"Redmond, WA",2018-06-20,Current Employee - Product Marketing Manager,Great place,"Flexible hours, great benefits, work isn't toooo hard","Limited room for advancement at times, not a wonderful place to be early career.",5.0,flexible hours great benefits work isnt toooo hard,flexible hour great benefit work not toooo hard,limited room for advancement at times not a wonderful place to be early career,limited room advancement time not wonderful place early career,flexible hour great benefit work not toooo hard limited room advancement time not wonderful place early career,0.8358,-0.5991,-0.15714285714285714,Negativo
none,2018-07-04,Current Employee - Anonymous Employee,Senior Data Scientist,Many things to learn and grow,A lot of people working on similar projects,4.0,many things to learn and grow,many thing learn grow,a lot of people working on similar projects,lot people work similar project,many thing learn grow lot people work similar project,0.0,0.0,0.0,Neutral
none,2018-06-30,Current Employee - Anonymous Employee,The score on Microsoft,Great opportunities to explore different businesses. There are not many composites that give you so much exposure.,Culture is lacking. It's becoming competitive to the point that his work doesn't matter as much as who's agenda you align with. Sad really.,4.0,great opportunities to explore different businesses there are not many composites that give you so much exposure,great opportunity explore different business not many composite give much exposure,culture is lacking its becoming competitive to the point that his work doesnt matter as much as whos agenda you align with sad really,culture lack become competitive point work not matter much agenda align sad really,great opportunity explore different business not many composite give much exposure culture lack become competitive point work not matter much agenda align sad really,0.7717,-0.3557,0.08750000000000001,Negativo
none,2018-06-18,Current Employee - Anonymous Employee,Manager,Great compensation and work hours,NONE THAT I CAN THINK OF,5.0,great compensation and work hours,great compensation work hour,none that i can think of,none think,great compensation work hour none think,0.6249,0.0,0.0,Neutral
none,2018-07-02,Former Employee - Anonymous Employee,Finance Analyst,Great location - huge company with many teams working on different products and services,Hard to push things through - many layers of management and eventually many good ideas just get lost on the way.,4.0,great location  huge company with many teams working on different products and services,great location huge company many team work different product service,hard to push things through  many layers of management and eventually many good ideas just get lost on the way,hard push thing many layer management eventually many good idea get lose way,great location huge company many team work different product service hard push thing many layer management eventually many good idea get lose way,0.7506,0.0516,0.3520833333333333,Positivo
none,2018-06-30,Former Employee - Anonymous Employee,Find the right group and you are good - wrong group - run for the hills,Lots of opportunities to move around internally,Each group is like its own little company and some of them are very backstabbing,4.0,lots of opportunities to move around internally,lot opportunity move around internally,each group is like its own little company and some of them are very backstabbing,group like little company backstabbing,lot opportunity move around internally group like little company backstabbing,0.3818,0.3612,0.2041666666666667,Positivo
none,2018-06-30,Former Employee - Anonymous Employee,Sr. Director of Product Management,"Very talented people, many opportunities","Passive aggressive behavior is the only way to get ahead, everyone does it",3.0,very talented people many opportunities,talented people many opportunity,passive aggressive behavior is the only way to get ahead everyone does it,passive aggressive behavior way get ahead everyone,talented people many opportunity passive aggressive behavior way get ahead everyone,0.7346,0.0516,0.0,Positivo
"Redmond, WA",2018-07-02,Former Employee - Anonymous Employee,Review,"Dynamic, flxible, great culture. Diversity celebrated.","Siloed, lots of change, waterfall driven v Agile",4.0,dynamic flxible great culture diversity celebrated,dynamic flxible great culture diversity celebrate,siloed lots of change waterfall driven v agile,siloe lot change waterfall drive v agile,dynamic flxible great culture diversity celebrate siloe lot change waterfall drive v agile,0.886,0.0,0.5,Neutral
"Redmond, WA",2018-07-23,Current Employee - Boss,"Toxic, racist, boys club. If you are anyone other than a 40+ white male, stay away.",Compensation is high for Seattle Puget Sound area,"Highly racist organization. Daily micro aggressions (and blatant racism) asserted towards POCs. Boys club with widespread sexual harassment and collusion across the company. Company puts a lot of energy and effort to manage perceptions around racism, gender bias, etc., but it is a show.  Completely bland and soul-sucking culture. Most are there for the money. I rarely saw true passion exhibited.  Awful work-life balance, similar to Amazon.  Disgusting, stifling level of politics. I wonder if half that time was put into innovation, how much further the company could go. Get out of this position of trying to chase Amazon/Apple/Google or some awful idea your Manager’s Manager came up with because they’ve been at Microsoft 20+ years and lost touch with current tech/media/business trends and/or got their job based on politics, instead of actual competency.  Where are these Directors/GMs being found? Hire leaders with actual desire and competency to be people leaders, not just managing cost centers.  Unless you are trying to put your kids through private school or need a Visa, I’m at a complete loss as to why anyone works here.",1.0,compensation is high for seattle puget sound area,compensation high seattle puget sound area,highly racist organization daily micro aggressions and blatant racism asserted towards pocs boys club with widespread sexual harassment and collusion across the company company puts a lot of energy and effort to manage perceptions around racism gender bias etc but it is a show  completely bland and soulsucking culture most are there for the money i rarely saw true passion exhibited  awful worklife balance similar to amazon  disgusting stifling level of politics i wonder if half that time was put into innovation how much further the company could go get out of this position of trying to chase amazonapplegoogle or some awful idea your manager’s manager came up with because they’ve been at microsoft  years and lost touch with current techmediabusiness trends andor got their job based on politics instead of actual competency  where are these directorsgms being found hire leaders with actual desire and competency to be people leaders not just managing cost centers  unless you are trying to put your kids through private school or need a visa i’m at a complete loss as to why anyone works here,highly racist organization daily micro aggression blatant racism assert towards poc boy club widespread sexual harassment collusion across company company put lot energy effort manage perception around racism gender bias etc show completely bland soulsucke culture money rarely see true passion exhibit awful worklife balance similar amazon disgusting stifle level politic wonder half time put innovation much company could go get position try chase amazonapplegoogle awful idea manager ’s manager come ’ve microsoft year lose touch current techmediabusiness trend andor get job base politic instead actual competency directorsgm find hire leader actual desire competency people leader not manage cost center unless try put kid private school need visa ’m complete loss anyone work,compensation high seattle puget sound area highly racist organization daily micro aggression blatant racism assert towards poc boy club widespread sexual harassment collusion across company company put lot energy effort manage perception around racism gender bias etc show completely bland soulsucke culture money rarely see true passion exhibit awful worklife balance similar amazon disgusting stifle level politic wonder half time put innovation much company could go get position try chase amazonapplegoogle awful idea manager ’s manager come ’ve microsoft year lose touch current techmediabusiness trend andor get job base politic instead actual competency directorsgm find hire leader actual desire competency people leader not manage cost center unless try put kid private school need visa ’m complete loss anyone work,0.0,-0.9734,-0.1012280701754386,Negativo
"Redmond, WA",2018-06-13,Current Employee - Software Engineer-II,Great work life balance,A company where you feel like the work you are doing affects the lives of millions of people,Benefits and bonuses are low compared to other companies,5.0,a company where you feel like the work you are doing affects the lives of millions of people,company feel like work affect life million people,benefits and bonuses are low compared to other companies,benefit bonus low compare company,company feel like work affect life million people benefit bonus low compare company,0.3612,0.6249,-0.0625,Positivo
"India, TN",2018-06-17,Current Employee - Data Entry,5 years experience in data entry my work is my identity,I love Microsoft and biggest salary,I like challenges and any time ready,5.0,i love microsoft and biggest salary,love microsoft big salary,i like challenges and any time ready,like challenge time ready,love microsoft big salary like challenge time ready,0.6369,0.6486,0.2,Positivo
"Cheyenne, WY",2018-06-12,Current Employee - Data Center Technician Lead,Data Center Technician Lead,The benefits are great here but I would argue on par with other companies this size. I believe in Microsoft's mission and Satya is greatness!,Microsoft culture has not made it to the data centers. Data Centers are grey cubicles and extremely boring to work in.,5.0,the benefits are great here but i would argue on par with other companies this size i believe in microsofts mission and satya is greatness,benefit great would argue par company size believe microsoft mission satya greatness,microsoft culture has not made it to the data centers data centers are grey cubicles and extremely boring to work in,microsoft culture not make datum center datum center grey cubicle extremely boring work,benefit great would argue par company size believe microsoft mission satya greatness microsoft culture not make datum center datum center grey cubicle extremely boring work,0.1386,-0.3384,-0.525,Negativo
none,2018-06-29,Former Employee - Anonymous Employee,"Passive-Agressive Management, Useless HR People",Interesting work in some groups.,Target of discrimination. HR ignored the issue. No way to reign in malicious managers.,3.0,interesting work in some groups,interesting work group,target of discrimination hr ignored the issue no way to reign in malicious managers,target discrimination hr ignore issue no way reign malicious manager,interesting work group target discrimination hr ignore issue no way reign malicious manager,0.4019,-0.5423,0.0,Negativo
"Redmond, WA",2018-06-29,Current Employee - Anonymous Employee,Senior software engineer,"Great people, culture and benefits",Many old technology and legacy products to maintain. Opportunities are limited.,3.0,great people culture and benefits,great people culture benefit,many old technology and legacy products to maintain opportunities are limited,many old technology legacy product maintain opportunity limit,great people culture benefit many old technology legacy product maintain opportunity limit,0.7717,0.1779,0.1761904761904762,Positivo
"Bellevue, WA",2018-06-14,Current Employee - Software Engineer II,Its perfect,Nice environment for an engineer to work and learn latest technologies,nothing found as of now,5.0,nice environment for an engineer to work and learn latest technologies,nice environment engineer work learn late technology,nothing found as of now,nothing find,nice environment engineer work learn late technology nothing find,0.4215,0.0,0.0,Neutral
"Redmond, WA",2018-06-27,Current Employee - Senior Program Manager,Great,"Work on cutting edge technologies, good work-life balance","Large organization, so at times might be challenging to get things done",4.0,work on cutting edge technologies good worklife balance,work cut edge technology good worklife balance,large organization so at times might be challenging to get things done,large organization time might challenge get thing do,work cut edge technology good worklife balance large organization time might challenge get thing do,0.34,0.1531,0.35714285714285715,Positivo
"Reno, NV",2018-07-19,Former Employee - Project Manager,Project Manager,Nice cafeteria and little else,"Everything else. Poor mid management, incompetent project/program mangers. Needed to hire an outside contractor to teach the FTE's how to use Microsoft Project. Not one person knew what a critical path schedule was or even that their own software was supposed to produce one.",1.0,nice cafeteria and little else,nice cafeteria little else,everything else poor mid management incompetent projectprogram mangers needed to hire an outside contractor to teach the ftes how to use microsoft project not one person knew what a critical path schedule was or even that their own software was supposed to produce one,everything else poor mid management incompetent projectprogram manger need hire outside contractor teach fte use microsoft project not one person know critical path schedule even software suppose produce one,nice cafeteria little else everything else poor mid management incompetent projectprogram manger need hire outside contractor teach fte use microsoft project not one person know critical path schedule even software suppose produce one,0.4215,-0.8176,-0.025000000000000005,Negativo
none,2018-06-28,Current Employee - Anonymous Employee,Senior Software Engineer,Work life balance is good,Compensation is not at par with industry,2.0,work life balance is good,work life balance good,compensation is not at par with industry,compensation not par industry,work life balance good compensation not par industry,0.4404,0.0,0.0,Neutral
"Redmond, WA",2018-06-21,Former Employee - Principal User Experience Designer,Great company and improving culture,"Exciting place to work. You can work on almost anything if you put your mind to it. The company has a good culture now after overcoming some of the overly aggressive ""dude culture"" from earlier years.",Schedule can be tough if you don't manage it well. Many managers will take as much of you as they can get so you need to set reasonable boundaries.,4.0,exciting place to work you can work on almost anything if you put your mind to it the company has a good culture now after overcoming some of the overly aggressive dude culture from earlier years,exciting place work work almost anything put mind company good culture overcome overly aggressive dude culture early year,schedule can be tough if you dont manage it well many managers will take as much of you as they can get so you need to set reasonable boundaries,schedule tough not manage well many manager take much get need set reasonable boundary,exciting place work work almost anything put mind company good culture overcome overly aggressive dude culture early year schedule tough not manage well many manager take much get need set reasonable boundary,0.6705,-0.3213,0.12777777777777777,Negativo
none,2018-06-26,Current Employee - Anonymous Employee,TPM,"Good learning opportunity, great environment and culture","Slower pace, long process and approval lines",4.0,good learning opportunity great environment and culture,good learning opportunity great environment culture,slower pace long process and approval lines,slow pace long process approval line,good learning opportunity great environment culture slow pace long process approval line,0.8689,0.4767,-0.05,Positivo
"Seattle, WA",2018-06-10,Current Employee - Partner Director of Product Management,Partner Director of Product Management,"Exciting work involving challenges across business, experience and technology.","Old cultures don't change overnight. Change takes time, but it's happening.",5.0,exciting work involving challenges across business experience and technology,exciting work involve challenge across business experience technology,old cultures dont change overnight change takes time but its happening,old culture not change overnight change take time happening,exciting work involve challenge across business experience technology old culture not change overnight change take time happening,0.5423,0.0,0.1,Neutral
"Bellevue, WA",2018-06-10,Current Employee - Solutions Architect,A title,"Great company with a lot of great people, and the luxury to invest in visions.","Big and sometimes very bureaucratic. Very afraid it cannot shake the reputation, aquired in the 90's and early 2000's of being evil.",5.0,great company with a lot of great people and the luxury to invest in visions,great company lot great people luxury invest vision,big and sometimes very bureaucratic very afraid it cannot shake the reputation aquired in the s and early s of being evil,big sometimes bureaucratic afraid not shake reputation aquire early evil,great company lot great people luxury invest vision big sometimes bureaucratic afraid not shake reputation aquire early evil,0.8779,-0.597,-0.296,Negativo
none,2018-06-10,Current Employee - Anonymous Employee,Great place to work,Lot of freedom and opportunity to impact,Not many that I can think of,5.0,lot of freedom and opportunity to impact,lot freedom opportunity impact,not many that i can think of,not many think,lot freedom opportunity impact not many think,0.7906,0.0,-0.25,Neutral
