location,dates,job-title,summary,pros,cons,overall-ratings,pros_clean,pros_lemmas,cons_clean,cons_lemmas,full_review_lemmas,pros_vader,cons_vader,cons_textblob,sentiment_final
none,2018-03-19,Current Employee - Product Advisor,Business Administrator,"Benefits, Culture, People, Reputation, Knowledge","Busy, time consuming, work and life balance",5.0,benefits culture people reputation knowledge,benefit culture people reputation knowledge,busy time consuming work and life balance,busy time consume work life balance,benefit culture people reputation knowledge busy time consume work life balance,0.3818,0.0,0.1,Neutral
"Redmond, WA",2018-03-19,Current Employee - Anonymous Employee,Great place to work,- Great place to work - Good career opportunities,- Slow growth - Average compensation,5.0, great place to work  good career opportunities,great place work good career opportunity, slow growth  average compensation,slow growth average compensation,great place work good career opportunity slow growth average compensation,0.8625,0.3818,-0.22500000000000003,Positivo
"Redmond, WA",2018-03-20,Current Employee - Senior Content Manager,Microsoft review,Culture of collaboration. Every person can have an impact. Truly becoming data-driven. Working hard to support and retain women and minorities and to hire a diverse workforce.,Difficult to change disciplines. Limited career opportunities the longer you're there.,5.0,culture of collaboration every person can have an impact truly becoming datadriven working hard to support and retain women and minorities and to hire a diverse workforce,culture collaboration every person impact truly become datadriven work hard support retain woman minority hire diverse workforce,difficult to change disciplines limited career opportunities the longer youre there,difficult change discipline limited career opportunity long,culture collaboration every person impact truly become datadriven work hard support retain woman minority hire diverse workforce difficult change discipline limited career opportunity long,0.6369,-0.2023,-0.2857142857142857,Negativo
none,2018-04-02,Former Employee - Anonymous Employee,Great company if on right team,Best company to work for if you have a good team.,Awful experience if your team sucks.,4.0,best company to work for if you have a good team,good company work good team,awful experience if your team sucks,awful experience team suck,good company work good team awful experience team suck,0.7964,-0.6705,-0.65,Negativo
"Redmond, WA",2018-04-02,Current Employee - Senior Software Development Engineer,Senior Software Development Engineer,"Very stable, great benefits, huge variety of products to work on","Lots of bureaucracy, lots of time spent on compliance, commute to Redmond",4.0,very stable great benefits huge variety of products to work on,stable great benefit huge variety product work,lots of bureaucracy lots of time spent on compliance commute to redmond,lot bureaucracy lot time spend compliance commute redmond,stable great benefit huge variety product work lot bureaucracy lot time spend compliance commute redmond,0.9008,0.0,-0.1,Neutral
"Bellevue, WA",2018-03-15,Current Employee - Software Engineer,Amazing work life balance,Work life balance Work culture Respect for co workers Companies values,"Slow growth Compensation Focus on making senior leadership happy, not on customers",5.0,work life balance work culture respect for co workers companies values,work life balance work culture respect co worker company value,slow growth compensation focus on making senior leadership happy not on customers,slow growth compensation focus make senior leadership happy not customer,work life balance work culture respect co worker company value slow growth compensation focus make senior leadership happy not customer,0.7003,0.743,0.25,Positivo
"Bellevue, WA",2018-03-19,Current Employee - Software Development Engineer,Great company,"Good innovative and diverse products, great life/work balance. Very stable company. Managers do not push to produce big results, flexibility to learn.","Open space is not everywhere, a lot of office-system buildings. No free food. People stay in same teams for a long time.",5.0,good innovative and diverse products great lifework balance very stable company managers do not push to produce big results flexibility to learn,good innovative diverse product great lifework balance stable company manager not push produce big result flexibility learn,open space is not everywhere a lot of officesystem buildings no free food people stay in same teams for a long time,open space not everywhere lot officesystem building no free food people stay team long time,good innovative diverse product great lifework balance stable company manager not push produce big result flexibility learn open space not everywhere lot officesystem building no free food people stay team long time,0.9299,0.2732,-0.0625,Positivo
"Auburn, AL",2018-03-19,Former Employee - Bartender,Bartender,Cleaning & bartender are more I just really need a job,I don't have anything to say about this,5.0,cleaning  bartender are more i just really need a job,clean bartender really need job,i dont have anything to say about this,not anything say,clean bartender really need job not anything say,0.0,0.0,0.0,Neutral
"Redmond, WA",2018-04-01,Current Employee - Senior Program Manager,Leaving,Compensation Benefits Proud Innovative Cloud leader,Culture restricts working outside of Redmond,4.0,compensation benefits proud innovative cloud leader,compensation benefit proud innovative cloud leader,culture restricts working outside of redmond,culture restrict work outside redmond,compensation benefit proud innovative cloud leader culture restrict work outside redmond,0.8225,-0.3182,0.0,Negativo
none,2018-04-02,Former Employee - Anonymous Employee,Sr Account Delivery Exeutive,great health benefits and 401k,poor management with extremely political environment which is completely unconcerned with diversity in any form,2.0,great health benefits and k,great health benefit k,poor management with extremely political environment which is completely unconcerned with diversity in any form,poor management extremely political environment completely unconcerned diversity form,great health benefit k poor management extremely political environment completely unconcerned diversity form,0.7717,-0.6478,-0.10000000000000002,Negativo
"Burlington, MA",2018-03-07,Former Employee - Executive Assistant,Loved working for Microsoft,"Respectful, intelligent and dedicated employees. As an Executive Assistant, I worked remotely supporting an Executive who traveled non-stop and was paid overtime - earning 33% more annually than my base salary. Excellent benefits and 401k matching including $800 year reimbursement for anything fitness or wellness related.",Tons of overtime and 24/7 on-call mentality overall.,5.0,respectful intelligent and dedicated employees as an executive assistant i worked remotely supporting an executive who traveled nonstop and was paid overtime  earning  more annually than my base salary excellent benefits and k matching including  year reimbursement for anything fitness or wellness related,respectful intelligent dedicated employee executive assistant work remotely support executive travel nonstop pay overtime earn annually base salary excellent benefit k matching include year reimbursement anything fitness wellness relate,tons of overtime and  oncall mentality overall,ton overtime oncall mentality overall,respectful intelligent dedicated employee executive assistant work remotely support executive travel nonstop pay overtime earn annually base salary excellent benefit k matching include year reimbursement anything fitness wellness relate ton overtime oncall mentality overall,0.969,0.0,0.0,Neutral
"Redmond, WA",2018-03-17,Current Employee - Principal Program Manager Lead,Growth Mindset,"You can engineer anything here, from Xbox games to Surface hardware to Office productivity apps to Windows OS to Azure services, and it's easy to move between these teams. The great work/life balance is made possible by well-honed processes and plenty of support that makes it easy to plan time away and get home in time for dinner with the family. Since Satya took over as CEO, the culture has had a major shift towards a growth mindset, so everyone's always learning and challenging themselves, and the corporate results reflect that growth.","Program Management is different than Product Management at other tech companies, doing a bit more design and a bit less market understanding. Microsoft is starting to shift that role, but it has some growing pains around the relationship between PM and Design, and how the company approaches new investments.",5.0,you can engineer anything here from xbox games to surface hardware to office productivity apps to windows os to azure services and its easy to move between these teams the great worklife balance is made possible by wellhoned processes and plenty of support that makes it easy to plan time away and get home in time for dinner with the family since satya took over as ceo the culture has had a major shift towards a growth mindset so everyones always learning and challenging themselves and the corporate results reflect that growth,engineer anything xbox game surface hardware office productivity app window os azure service easy move team great worklife balance make possible wellhone process plenty support make easy plan time away get home time dinner family since satya take ceo culture major shift towards growth mindset everyone always learn challenge corporate result reflect growth,program management is different than product management at other tech companies doing a bit more design and a bit less market understanding microsoft is starting to shift that role but it has some growing pains around the relationship between pm and design and how the company approaches new investments,program management different product management tech company bit design bit less market understand microsoft start shift role grow pain around relationship pm design company approach new investment,engineer anything xbox game surface hardware office productivity app window os azure service easy move team great worklife balance make possible wellhone process plenty support make easy plan time away get home time dinner family since satya take ceo culture major shift towards growth mindset everyone always learn challenge corporate result reflect growth program management different product management tech company bit design bit less market understand microsoft start shift role grow pain around relationship pm design company approach new investment,0.9545,-0.3919,0.05744949494949495,Negativo
none,2018-04-02,Former Employee - Anonymous Employee,Account Executive,Good health care benefits and options,Terrible teamwork and strategy for territory,2.0,good health care benefits and options,good health care benefit option,terrible teamwork and strategy for territory,terrible teamwork strategy territory,good health care benefit option terrible teamwork strategy territory,0.8271,-0.4767,-1.0,Negativo
none,2018-03-29,Former Employee - Anonymous Employee,Xbox - playing games w/ people isn't good for making great games,"some very talented, smart and committed people competitive salary good work/life balance great benefits Pro Club",dog eat dog environment - depending on team little transparency or accountability need to build own network for survival don't try anything new without executive sponsorship and be prepared to surrender credit and involvement if your idea sticks,3.0,some very talented smart and committed people competitive salary good worklife balance great benefits pro club,talented smart committed people competitive salary good worklife balance great benefit pro club,dog eat dog environment  depending on team little transparency or accountability need to build own network for survival dont try anything new without executive sponsorship and be prepared to surrender credit and involvement if your idea sticks,dog eat dog environment depend team little transparency accountability need build network survival not try anything new without executive sponsorship prepared surrender credit involvement idea stick,talented smart committed people competitive salary good worklife balance great benefit pro club dog eat dog environment depend team little transparency accountability need build network survival not try anything new without executive sponsorship prepared surrender credit involvement idea stick,0.9582,0.5423,0.18295454545454545,Positivo
none,2018-03-31,Former Employee - Anonymous Employee,Software Engineer,Work life balance is good. Benefit is good.,Payment is not competitive. And lots of politicals.,3.0,work life balance is good benefit is good,work life balance good benefit good,payment is not competitive and lots of politicals,payment not competitive lot political,work life balance good benefit good payment not competitive lot political,0.8316,-0.1326,0.0,Negativo
none,2018-03-31,Former Employee - Anonymous Employee,Software Engineer,Work life balance is good. Benefit is good.,Payment is not competitive. And lots of politicals.,3.0,work life balance is good benefit is good,work life balance good benefit good,payment is not competitive and lots of politicals,payment not competitive lot political,work life balance good benefit good payment not competitive lot political,0.8316,-0.1326,0.0,Negativo
none,2018-03-16,Current Employee - Anonymous Employee,Goood,Keep up the good work.,Can be more innovative in new areas.,5.0,keep up the good work,keep good work,can be more innovative in new areas,innovative new area,keep good work innovative new area,0.4404,0.4927,0.37878787878787873,Positivo
"Fargo, ND",2018-03-26,Current Employee - Customer Success Manager,Customer Success Manager,Working for Microsoft is a fantastic career opportunity. It will truly open doors for a future career. Focused on diversity and inclusion. They are invested in your development of technical acumen. You are at the forefront of cloud driven technological innovations.,"Internal tools is not a focus, and there is a lack of metrics for a data driven company. It is a huge company and it can sometimes be difficult to locate resources.",4.0,working for microsoft is a fantastic career opportunity it will truly open doors for a future career focused on diversity and inclusion they are invested in your development of technical acumen you are at the forefront of cloud driven technological innovations,work microsoft fantastic career opportunity truly open door future career focus diversity inclusion invest development technical acuman forefront cloud drive technological innovation,internal tools is not a focus and there is a lack of metrics for a data driven company it is a huge company and it can sometimes be difficult to locate resources,internal tool not focus lack metric data drive company huge company sometimes difficult locate resource,work microsoft fantastic career opportunity truly open door future career focus diversity inclusion invest development technical acuman forefront cloud drive technological innovation internal tool not focus lack metric data drive company huge company sometimes difficult locate resource,0.8979,-0.3612,-0.03333333333333335,Negativo
"Knoxville, TN",2018-04-19,Current Employee - Anonymous Employee,Where Do I Begin,"It's Microsoft, so there's that.",Almost 4 years and STILL in a kiosk Upper Management? Laughable. Current Management? I'll reserve comment. Room for Advancement? Unless you're willing to fake it 'til you make it...nope.,1.0,its microsoft so theres that,microsoft,almost  years and still in a kiosk upper management laughable current management ill reserve comment room for advancement unless youre willing to fake it til you make itnope,almost year still kiosk upper management laughable current management ill reserve comment room advancement unless willing fake til make itnope,microsoft almost year still kiosk upper management laughable current management ill reserve comment room advancement unless willing fake til make itnope,0.0,-0.533,-0.15,Negativo
none,2018-04-18,Former Employee - Anonymous Employee,Sewing circle,Free food and snacks as well as location,"Horrible people , devoid of human feelings",1.0,free food and snacks as well as location,free food snack well location,horrible people  devoid of human feelings,horrible people devoid human feeling,free food snack well location horrible people devoid human feeling,0.6597,-0.5423,-0.3666666666666667,Negativo
"New York, NY",2018-03-10,Current Employee - Account Technology Strategist,Big name player in the industry,"Benefits are second only to amazon and google. Other companies in other industries do not come close with benefits. Excellent vision , mindset and leadership from the CEO Satya Nadella.","In the field, for sales and services it is really all about hitting your numbers vs what the CEO says the bison is, which is being customer obsessed. Forcing customers to buy what you need them to buy to hit your sales numbers to get paid is not being customer obsessed it’s being obsessed with making money short term.",5.0,benefits are second only to amazon and google other companies in other industries do not come close with benefits excellent vision  mindset and leadership from the ceo satya nadella,benefit second amazon google company industry not come close benefit excellent vision mindset leadership ceo satya nadella,in the field for sales and services it is really all about hitting your numbers vs what the ceo says the bison is which is being customer obsessed forcing customers to buy what you need them to buy to hit your sales numbers to get paid is not being customer obsessed it’s being obsessed with making money short term,field sale service really hit number vs ceo say bison customer obsess force customer buy need buy hit sale number get pay not customer obsess ’s obsess make money short term,benefit second amazon google company industry not come close benefit excellent vision mindset leadership ceo satya nadella field sale service really hit number vs ceo say bison customer obsess force customer buy need buy hit sale number get pay not customer obsess ’s obsess make money short term,0.891,-0.4767,-0.26,Negativo
none,2018-03-13,Former Employee - Anonymous Employee,Program Manager,Great freedom to add individual direction and improvements,There are many competing projects and individuals,5.0,great freedom to add individual direction and improvements,great freedom add individual direction improvement,there are many competing projects and individuals,many compete project individual,great freedom add individual direction improvement many compete project individual,0.891,0.0,0.5,Neutral
"Redmond, WA",2018-03-13,Former Employee - BDM,BDM,"Wonderful work and team dynamics. Very smart people making the work interesting, challenging and fun.",None that I can think of.,5.0,wonderful work and team dynamics very smart people making the work interesting challenging and fun,wonderful work team dynamic smart people make work interesting challenge fun,none that i can think of,none think,wonderful work team dynamic smart people make work interesting challenge fun none think,0.9371,0.0,0.0,Neutral
none,2018-03-14,Former Employee - Anonymous Employee,Good benefits,"Good benefits, especially in healthcare","Very large company, hard to stand out",5.0,good benefits especially in healthcare,good benefit especially healthcare,very large company hard to stand out,large company hard stand,good benefit especially healthcare large company hard stand,0.6705,-0.1689,-0.006547619047619052,Negativo
none,2018-03-27,Current Employee - Anonymous Employee,just ok,work life balance is ok,pay is lagging behind competition,4.0,work life balance is ok,work life balance ok,pay is lagging behind competition,pay lag behind competition,work life balance ok pay lag behind competition,0.296,-0.3612,-0.4,Negativo
"Issaquah, WA",2018-03-27,Former Employee - Service Engineer II,Challenging and problem solving opportunities leveraging MS technologies,Loads of technical resources to learn new skills or enhance existing ones. Lots of opportunities in solving and improving systems or applications.,Office drama and politics. Lack of transparency from management which can lead to lack of collaboration due to competitive teams.,3.0,loads of technical resources to learn new skills or enhance existing ones lots of opportunities in solving and improving systems or applications,load technical resource learn new skill enhance exist one lot opportunity solve improve system application,office drama and politics lack of transparency from management which can lead to lack of collaboration due to competitive teams,office drama politic lack transparency management lead lack collaboration due competitive team,load technical resource learn new skill enhance exist one lot opportunity solve improve system application office drama politic lack transparency management lead lack collaboration due competitive team,0.7783,-0.4404,-0.125,Negativo
"Redmond, WA",2018-03-12,Current Employee - Senior Manager,Large Company with great benefits,Microsoft has great benefits and the work-life balance is wonderful. You can make your job as easy as you like it or as hard as you would like. There are a lot of opportunities to get involved in different events within the organization and there are numerous ways to give back to the community while working at Microsoft.,Its a large company so you can get lost in the system if you are not able to Network. It is very hard to figure out what is your next role since the organization is so large. Promotions can be hard to come by if you are not proactive in pushing yourself in front of management.,5.0,microsoft has great benefits and the worklife balance is wonderful you can make your job as easy as you like it or as hard as you would like there are a lot of opportunities to get involved in different events within the organization and there are numerous ways to give back to the community while working at microsoft,microsoft great benefit worklife balance wonderful make job easy like hard would like lot opportunity get involve different event within organization numerous way give back community work microsoft,its a large company so you can get lost in the system if you are not able to network it is very hard to figure out what is your next role since the organization is so large promotions can be hard to come by if you are not proactive in pushing yourself in front of management,large company get lose system not able network hard figure next role since organization large promotion hard come not proactive push front management,microsoft great benefit worklife balance wonderful make job easy like hard would like lot opportunity get involve different event within organization numerous way give back community work microsoft large company get lose system not able network hard figure next role since organization large promotion hard come not proactive push front management,0.9612,-0.72,-0.08204365079365082,Negativo
none,2018-03-12,Current Employee - Anonymous Employee,Salary,Love the work culture at Microsoft,None. I feel motivated to work here,5.0,love the work culture at microsoft,love work culture microsoft,none i feel motivated to work here,none feel motivated work,love work culture microsoft none feel motivated work,0.6369,-0.357,0.0,Negativo
none,2018-03-23,Former Employee - Anonymous Employee,Programming Writer,"It's a big company with so many different subgroups so if one group isn't a good fit you can find another that is. There are also a lot of employee activities and social interest groups, like a big college campus.",The annual review process can be arduous. I've heard pay is lower for developers there than at other large software companies.,4.0,its a big company with so many different subgroups so if one group isnt a good fit you can find another that is there are also a lot of employee activities and social interest groups like a big college campus,big company many different subgroup one group not good fit find another also lot employee activity social interest group like big college campus,the annual review process can be arduous ive heard pay is lower for developers there than at other large software companies,annual review process arduous hear pay low developer large software company,big company many different subgroup one group not good fit find another also lot employee activity social interest group like big college campus annual review process arduous hear pay low developer large software company,0.2462,-0.3818,-0.08690476190476189,Negativo
none,2018-03-11,Current Employee - Anonymous Employee,Great place to work,Fun impactful work with work life flexibility,We are playing catch-up in many fields,5.0,fun impactful work with work life flexibility,fun impactful work work life flexibility,we are playing catchup in many fields,play catchup many field,fun impactful work work life flexibility play catchup many field,0.6908,0.2023,0.5,Positivo
none,2018-03-25,Current Employee - Anonymous Employee,Great company,Lots of great benefits and changes to learn.,"No real cons, the workplace was a bit crowded.",4.0,lots of great benefits and changes to learn,lot great benefit change learn,no real cons the workplace was a bit crowded,no real con workplace bit crowded,lot great benefit change learn no real con workplace bit crowded,0.7717,-0.296,-0.1,Negativo
